title,primary_field,1900,1905,1910,1915,1920,1925,1930,1935,1940,1945,1950,1955,1960,1965,1970,1975,1980,1985,1990,1995,2000,2005,2010,2015,2020,score_sum,total_years_pub,time_weighted_score
An Algorithm for Vector Quantizer Design,Statistical model,,,,,,,,,,,,,,,,,,,1.63,2.33,2.56,2.55,2.47,2.34,2.15,305.838,8,38.23
Modern Aspects of Electrochemistry,Chemistry,,,,,,,,,,,,,,,,,,,,,,3.15,3.08,2.98,2.74,191.128,5,38.226
Estimation of the Concentration of Low-Density Lipoprotein Cholesterol in Plasma  Without Use of the Preparative Ultracentrifuge,Chromatography,,,,,,,,,,,,,,,,,,,1.32,1.92,2.16,2.33,2.43,2.44,2.28,305.582,8,38.198
A low-cost  high-efficiency solar cell based on dye-sensitized colloidal TiO2 films,Quantum dot solar cell,,,,,,,,,,,,,,,,,,,,,,2.13,2.7,3.11,2.99,190.792,5,38.158
Inhibited spontaneous emission in solid-state physics and electronics,Solid-state physics,,,,,,,,,,,,,,,,,,,,,,2.64,3.05,3.06,2.84,190.735,5,38.147
On the Mechanics of Economic Development,Economics,,,,,,,,,,,,,,,,,,,,,2.15,2.6,2.8,2.85,2.65,228.689,6,38.115
Astrophysics of Gaseous Nebulae and Active Galactic Nuclei,Atomic physics,,,,,,,,,,,,,,,,,,,,,2.56,2.85,2.89,2.78,2.55,228.66,6,38.11
Fast algorithms for mining association rules,FSA-Red Algorithm,,,,,,,,,,,,,,,,,,,,,,2.44,2.98,3.08,2.88,190.509,5,38.102
Elliptic partial differential equations of second order,Elliptic boundary value problem,,,,,,,,,,,,,,,,,,,1.7,2.1,2.32,2.41,2.45,2.39,2.24,304.294,8,38.037
Phase Annealing in SHELX-90: Direct Methods for Larger Structures,Direct method,,,,,,,,,,,,,,,,,,,,,2.37,3.03,2.93,2.74,2.51,228.188,6,38.031
A robust layered control system for a mobile robot,Control engineering,,,,,,,,,,,,,,,,,,,,2.02,2.61,2.7,2.68,2.56,2.35,266.095,7,38.014
Improved patch-clamp techniques for high-resolution current recording from cells and cell-free membrane patches.,Biology,,,,,,,,,,,,,,,,,,,1.93,2.5,2.64,2.59,2.45,2.3,2.1,303.597,8,37.95
Third Reference Catalogue of Bright Galaxies,Astronomy,,,,,,,,,,,,,,,,,,,,,2.58,2.89,2.88,2.76,2.54,227.585,6,37.931
Testing statistical hypotheses,Econometrics,,,,,,,,,,,,,,,,,,,2.75,2.69,2.57,2.45,2.37,2.28,2.11,303.244,8,37.905
The NCEP/NCAR 40-Year Reanalysis Project,Meteorology,,,,,,,,,,,,,,,,,,,,,,2.41,2.92,3.07,2.91,189.449,5,37.89
Coefficient alpha and the internal structure of tests,Sampling,,,,,,,,,,,,,,0.28,0.69,1.03,1.26,1.51,1.57,1.62,1.62,1.61,1.6,1.59,1.48,492.438,13,37.88
Numerical recipes in Fortran,Computational science,,,,,,,,,,,,,,,,,,,,,2.31,2.86,2.9,2.78,2.56,227.04,6,37.84
Basics of qualitative research : techniques and procedures for developing grounded theory,Applied mathematics,,,,,,,,,,,,,,,,,,,,,,,2.81,3.3,3.18,151.178,4,37.794
Data networks,Hierarchical network model,,,,,,,,,,,,,,,,,,,,,2.36,2.7,2.88,2.81,2.58,226.725,6,37.787
Communities of practice: Learning  meaning  and identity.,Psychology,,,,,,,,,,,,,,,,,,,,,,2.06,2.91,3.1,2.92,188.496,5,37.699
Cosmic Strings and Other Topological Defects,Classical mechanics,,,,,,,,,,,,,,,,,,,,,,3.11,3.12,2.96,2.72,188.204,5,37.641
Field Computation by Moment Methods,Computer Science,,,,,,,,,,,,,,,,,,1.86,2.0,2.24,2.32,2.32,2.27,2.16,1.98,338.731,9,37.637
